,sentence,entities,country_entities
112,Retrieved               Winter War  Russia Invades Finland   warfarehistorynetwork com  Retrieved               Why Finland allied itself with Nazi Germany   Letter   The Guardian              ISSN            Retrieved               Britain s  Phoney  Start To The Second World War   Imperial War Museums  Retrieved                     Churchill takes helm as Germans advance   BBC              Retrieved              Saunders  Tim               Fort Eben Emael  Casemate Publishers  ISBN                  BBC   History   World Wars  ,"['Russia Invades Finland', 'Nazi Germany', 'Letter', 'The Guardian              ISSN            Retrieved', 'Britain', 'Phoney', 'The Second World War   ', 'Imperial War Museums  Retrieved                     Churchill', 'Germans', 'BBC              Retrieved', 'Tim               Fort Eben', 'BBC']",[]
113,The Norway Campaign in World War Two   www bbc co uk  Retrieved               Germany s Invasion of Denmark and Norway   Bulletin of International News                      April       JSTOR            Levine  Paul A           Swedish neutrality during the Second World War  tactical success or moral compromise    In Wylie  Neville  ed    European Neutrals and Non Belligerents During the Second World War  Cambridge University Press  ISBN                  France to surrender   HISTORY     July       Retrieved               The Evacuation of Dunkirk   May        Historic UK  Retrieved               On This Day  France Surrenders to Nazi Germany   www findingdulcinea com     June       Retrieved              Zimmerman  Dwight   Charles de Gaulle and the Free French   Defense Media Network  Retrieved              Carrier  Richard                R flexions sur l efficacit  militaire de l arm e des Alpes        juin        Revue Historique des Arm es  in French                doi         rha           ISSN            S CID              Italy a burden on Hitler in World War II   World   Dunya News   dunyanews tv     February       Retrieved               Italy Tried to Invade Greece in World War II  ,"['The Norway Campaign in World', 'bbc', 'uk  ', 'Denmark', 'Norway', 'Bulletin of International News                      ', 'Swedish', 'the Second World War', 'Wylie', 'Neville', 'the Second World War  Cambridge University Press  ISBN', 'Dunkirk', 'UK', 'This Day', 'France Surrenders', 'Nazi Germany', 'Charles de Gaulle', 'Defense Media Network  Retrieved', 'Richard                ', 'militaire de l', 'Alpes        ', 'French', 'ISSN', 'Hitler', 'World War II', 'Dunya News', 'Greece', 'World War II']","['Denmark', 'Norway', 'Greece']"
114,It Was a Disaster   The National Interest              Retrieved                     Victory for RAF in Battle of Britain               Retrieved              Grant  Rebecca  October         ,"['The National Interest              Retrieved                     ', 'RAF', 'Battle', 'October']",[]
115,The Stuka Terror  Germany s shrieking Ju    dive bomber lingered in the mind as a truly dreaded air weapon   Air Force Magazine  Retrieved               BBC   History   Britain bombs Berlin  pictures  video  facts   news    www bbc co uk  Retrieved               BBC   History   Hitler postpones the invasion of Britain  pictures  video  facts   news    www bbc co uk  Retrieved               The Radar and the Battle of Britain   History Learning Site  Retrieved              Middleton  Drew                Hitler s Russian Blunder   The New York Times  ISSN            Retrieved              Shirer  William L          Rise And Fall Of The Third Reich  ,"['Germany', 'Ju', 'Air Force Magazine  Retrieved               ', 'BBC', 'Britain', 'Berlin', 'bbc', 'BBC', 'Hitler', 'Britain', 'bbc', 'Radar', 'the Battle of Britain', 'History Learning Site  Retrieved', 'Drew                Hitler s Russian Blunder', 'The New York Times', 'ISSN', 'William L          ']",['Germany']
116,A History of Nazi Germany  New York  Simon and Schuster  p       ISBN                  Operation Barbarossa   HISTORY     October       Retrieved               What Stalin Knew  The Enigma of Barbarossa   Central Intelligence Agency   www cia gov  Archived from the original on June           Retrieved              Hickman  Kennedy     September         Death in the Snow  Battle of Moscow   ThoughtCo  Retrieved               Rommel in Africa   HISTORY     November       Retrieved               World War II  North Africa Campaign   HistoryNet              Retrieved               World War II in the Middle East   warfarehistorynetwork com  Retrieved               Germany s Sixth Army in Stalingrad in World War II   HistoryNet              Retrieved               Germany declares war on the United States   HISTORY     November       Retrieved              Peck  Michael                ,"['Nazi Germany', 'New York', 'Simon', 'Schuster', 'Stalin Knew', 'cia', 'June           Retrieved', 'Moscow', 'ThoughtCo', 'Africa', 'World War II', 'World War II', 'the Middle East', 'Germany', 'Sixth Army', 'Stalingrad', 'World War II', 'the United States', 'Michael                ']",['Germany']
117,Why the Battle of Kursk Might Just Be the Most Misunderstood World War II Battle   The National Interest  Retrieved              Barr  Niall         Pendulum of War  ,"['Kursk', 'The National Interest  Retrieved', 'Niall         Pendulum']",[]
118,The Three Battles of El Alamein  Overlook Press  ISBN                 Evans  Richard J                 Why Hitler s grand plan during the second world war collapsed   The Guardian  ISSN            Retrieved              Herder  Brian Lane               Operation Torch       ,"['El Alamein', 'Overlook Press  ISBN                 ', 'Evans', 'second', 'Guardian', 'ISSN']",[]
119,The invasion of French North Africa  Bloomsbury Publishing  ISBN                     Years Ago  The United States Invasion of Italy   The National WWII Museum   New Orleans    September       Retrieved                     Italy s surrender announced   BBC              Retrieved               Liberating Rome and Central Italy  a World War II Online Interactive  Released   American Battle Monuments Commission    June       Retrieved              Syrett  David         The Defeat of the German U boats  The Battle of the Atlantic  Columbia  SC  Univ of South Carolina Press  pp  ix  ISBN                  What You Need To Know About The Battle Of The Atlantic   Imperial War Museums  Retrieved              Ross  John               The Forecast for D day  And the Weatherman behind Ike s Greatest Gamble  Lyons Press  ISBN                 Hall  Anthony         D Day  Operation Overlord Day by Day  MBI Publishing Company LLC  p      ISBN                 Palek  Stephanie                Operation Valkyrie        www lib cam ac uk  Retrieved              Balfour  Michael         Withstanding Hitler  London  Routledge  p       ISBN                  Aug             Paris Is Liberated After   Year Nazi Occupation   The Learning Network              Retrieved              Hollingham  Richard    September         V   The Nazi rocket that launched the space age   BBC  Retrieved    December            Bloodiest Battles of World War II   www militaryeducation org  Archived from the original on             Retrieved               How Churchill  Roosevelt,"['French', 'North Africa', 'Bloomsbury Publishing', 'Years Ago', 'The United States Invasion of', 'The National WWII Museum', 'New Orleans', 'Italy', 'BBC              Retrieved               Liberating Rome', 'Central Italy', 'World War II Online Interactive', 'American Battle Monuments Commission', 'German', 'The Battle of the Atlantic  Columbia', 'SC', 'Univ of South Carolina', 'The Battle Of The Atlantic', 'Imperial War Museums  Retrieved              Ross', 'John               ', 'Weatherman', 'Ike', 'ISBN                 Hall  Anthony         D Day  Operation Overlord Day by Day  MBI Publishing Company LLC  p      ISBN                 Palek  Stephanie                Operation Valkyrie        ', 'lib cam', 'Withstanding Hitler', 'London', 'Paris', 'Liberated', 'Year', 'Nazi Occupation', 'The Learning Network              Retrieved', 'Nazi', 'BBC', 'World War II', 'Roosevelt']",['Italy']
120,And Stalin Planned To End The Second World War   Imperial War Museums  Retrieved               The Cold War origins          The Yalta Conference   BBC  Retrieved    December        ,"['Stalin Planned To', 'The Second World War   ', 'Imperial War Museums  Retrieved               The Cold War', 'BBC']",[]
121,Biddiscombe  Alexander Perry  Biddiscombe  Perry         Werwolf   The History of the National Socialist Guerrilla Movement             Toronto  University of Toronto Press  p       ISBN                 Linge  Heinz         With Hitler to the End  The Memoirs of Adolf Hitler s Valet  Frontline Books  p       ISBN                  May           Nazi Germany Surrenders in World War II   The Learning Network              Retrieved              Horvitz  Leslie Alan  Catherwood  Christopher         Encyclopedia of War Crimes and Genocide  New York  Infobase Publishing  p       ISBN                 Han  Suk Jung                The Problem of Sovereignty  Manchukuo              Positions  East Asia Cultures Critique                   doi                            ,"['Alexander Perry  Biddiscombe  Perry         Werwolf', 'the National Socialist Guerrilla Movement             Toronto  University of Toronto Press  p       ISBN                 Linge  Heinz         With Hitler', 'Adolf Hitler s Valet  Frontline Books  p       ISBN                  May           ', 'World War II', 'The Learning Network              Retrieved', 'Leslie Alan  Catherwood', 'Christopher         Encyclopedia', 'War Crimes and Genocide', 'New York', 'Infobase Publishing  p       ISBN                 Han', 'Suk Jung                The Problem of Sovereignty  Manchukuo              Positions  East Asia Cultures Critique                   ']",[]
122,ISSN            S CID              BBC   History   World Wars  Japan s Quest for Empire   www bbc co uk  Retrieved              Cavendish  Richard    July         ,"['BBC', 'bbc', 'uk  ', 'Cavendish']",[]
123,The Marco Polo Bridge Incident   History Today           Kaiser  Davi  July            ,[],[]
124,The War That Started    Years Ago Wouldn t Happen Today  ,['The War That Started'],[]
125,We Can Still Learn From It   ,[],[]
126,Time  Retrieved               Second Sino Japanese War             Anti Japanese War   Eight Year War of Resistance   www globalsecurity org  Retrieved               The Avalon Project  Summary of the Three Power Pact Between Germany  Italy  and Japan  Signed at Berlin  September            avalon law yale edu  Retrieved               The Forgotten Reason Why Japan Attacked Pearl Harbor   The National Interest              Retrieved               The United States declares war on Japan   HISTORY     November       Retrieved               The Declaration of War Against Japan   United States House of Representatives  History  Art   Archives   history house gov    December       ,"['Sino Japanese War             Anti Japanese War', 'Eight Year War of Resistance', 'Retrieved               The Avalon Project', 'the Three Power Pact Between', 'Germany', 'Italy', 'Japan', 'Berlin', 'September', 'Japan', 'Pearl Harbor', 'The National Interest              Retrieved               ', 'The United States', 'Japan', 'Japan', 'United States', 'House of Representatives  History  Art   Archives']","['Germany', 'Italy', 'Japan', 'Japan', 'Japan', 'Japan']"
127,Retrieved              Costello  John               The Pacific War             Harper Collins  ISBN                  The History Place   Timeline of Pacific War   www historyplace com  Retrieved               From the Jaws of Death  MacArthur s Escape from the Philippines   warfarehistorynetwork com     November       Retrieved               Bombing of Darwin   Australian Maritime Museum   stories anmm gov au  Archived from the original on             Retrieved               Battle of the Coral Sea   Naval History and Heritage Command  Retrieved              Keegan  John         The Second World War  New York  Penguin Books  p       ISBN                     Prange  Gordon W   Goldstein  Donald M   Dillon  Katherine V          Miracle at Midway  Open Road Media  p     ISBN                 Toll  Ian W                The Conquering Tide  War in the Pacific Islands             War in the Pacific Islands             W  W  Norton   Company  ISBN                  The Second Battle of Guam   Marine Corps Association   www mca marines org  Archived from the original on             Retrieved               The Last Aircraft Carrier Showdown  Welcome to the Battle of the Philippine Sea   The National Interest              Retrieved               The Largest Naval Sea Battles in Military History  ,"['John               ', 'Pacific War', 'the Jaws of Death  MacArthur s Escape', 'Philippines', 'Darwin', 'Australian', 'the Coral Sea', 'World War', 'New York  Penguin Books  p', 'Gordon W', 'Dillon  Katherine V          Miracle', 'Midway  Open Road Media  p     ISBN                 Toll  Ian W                The Conquering Tide  War', 'the Pacific Islands             War', 'the Pacific Islands', 'Norton', 'Marine Corps Association', 'mca', 'the Battle of the Philippine Sea', 'The National Interest              Retrieved               The Largest Naval Sea Battles']",['Philippines']
128,A Closer Look at the Largest and Most Influential Naval Battles in World History   Norwich University Online  Retrieved              Murphy  Daniel T                 The Geometry of War at Sea  ,['Daniel T                 '],[]
129,The Leyte Gulf Example   Center for International Maritime Security  Retrieved              Nichols  Robert  Spring         The first Kamikaze attack    Wartime       Brimelow  Ben                   years ago a war photographer snapped the most iconic image of World War II   here s the story of the battle behind the photo   Business Insider  Retrieved              Alexander  Joseph                The Battle of Iwo Jima  A    day bloody slog on a sulfuric island   Military Times  Retrieved              Burrell  Robert S                 Breaking the Cycle of Iwo Jima Mythology  A Strategic Study of Operation Detachment   The Journal of Military History                     doi         jmh            ISSN            S CID             Lacey  Laura     April         Battle of Okinawa   www militaryhistoryonline com  Retrieved              MacArthur  Douglas  Johnson  Harold K          Reports of General MacArthur  The Campaigns of MacArthur in the Pacific  Military Studies Press  p       ISBN                  Number of names,"['first', 'Kamikaze', 'years ago', 'World War II', 'Alexander  Joseph                The Battle of Iwo Jima', 'Military Times  Retrieved              Burrell  Robert S                 Breaking the Cycle of Iwo Jima Mythology  A Strategic Study of Operation Detachment', 'The Journal of Military History                     ', 'ISSN', 'Lacey  Laura     ', 'Okinawa', 'Douglas  Johnson  Harold K          Reports', 'MacArthur', 'MacArthur', 'the Pacific  Military Studies Press']",[]
130,Inscribed       www pref okinawa jp  Retrieved              Peck  Michael                Operation Downfall  How America Would Have Invaded Japan  ,"['Inscribed       ', 'Michael                Operation Downfall  How America Would Have Invaded', 'Japan']",['Japan']
131,It Would Have Been Hell    The National Interest  Retrieved               Potsdam Declaration   The Bombing of Hiroshima and Nagasaki   Historical Documents   atomicarchive com   www atomicarchive com  Retrieved              Maguire  Amy    September         World politics explainer  ,"['The National Interest  Retrieved               Potsdam Declaration', 'Hiroshima', 'Nagasaki']",[]
132,The atomic bombings of Hiroshima and Nagasaki   The Conversation  Retrieved              Ojo  Marvellous                Soviet Invasion of Manchuria  Finishing the Japanese Army   WAR HISTORY ONLINE  Retrieved              Andrew Glass     ,"['Hiroshima', 'Nagasaki', 'Manchuria', 'the Japanese Army', 'Andrew Glass']",[]
133,August         Hirohito accepts Japan s surrender terms  Aug             POLITICO  Retrieved               Japanese Instrument of Surrender         National Archives Foundation  Retrieved              Levi  Neil  Rothberg  Michael         The Holocaust  Theoretical Readings  Edinburgh University Press  ISBN                  How Was the Holocaust Planned    Boston com  Retrieved               The Kristallnacht Pogrom       November        ,"['August', 'Hirohito', 'Japan', 'Aug             POLITICO  Retrieved               Japanese Instrument of Surrender         National Archives Foundation  Retrieved              Levi  Neil', 'Rothberg  Michael         ', 'Edinburgh University Press  ISBN', 'Boston', 'The Kristallnacht Pogrom       ', 'November']",['Japan']
134,It Came From Within   Yad Vashem   www yadvashem org  Retrieved               The development of ghettos   ,['Yad Vashem'],[]
135,The Holocaust Explained  Designed for schools      June       Retrieved               Pictures from inside a Nazi controlled ghetto   www cbsnews com     July       Retrieved              Rhodes  Richard               Masters of Death  ,"['The Holocaust Explained  Designed', 'Nazi']",[]
136,The SS Einsatzgruppen and the Invention of the Holocaust  Knopf Doubleday Publishing Group  ISBN                 Hasic  Albinko     January         ,"['the Invention of the Holocaust', 'Knopf Doubleday Publishing Group']",[]
137,What People Get Wrong About the Nazi Conference to Plan the  Final Solution    Time  Retrieved               Mass deportations to the concentration and extermination camps   Holocaust   www holocaust cz  Retrieved              Arnett  George                Auschwitz  a short history of the largest mass murder site in human history   ,"['the Nazi Conference', 'Holocaust', 'George                Auschwitz']",[]
138,The Guardian  ISSN            Retrieved              Kirsch  Adam    April         ,"['Guardian', 'ISSN']",[]
139,The System  Two new histories show how the Nazi concentration camps worked   The New Yorker  Retrieved    December        Ghooi  Ravindra B           The Nuremberg Code A critique   Perspectives in Clinical Research                doi                          ISSN            PMC          PMID            Gutman  Israel         Encyclopedia of the Holocaust  Vol     New York  Macmillan  p        ISBN                 Haaretz                Holocaust Facts  Where Does the Figure of   Million Victims Come From    Haaretz  Retrieved              Blumberg  Antonia                The Holocaust s Forgotten Victims  The   Million Non Jewish People Killed By The Nazis   Huffington Post  Retrieved               Non Jewish Victims of the Holocaust   www jewishvirtuallibrary org  Retrieved               Nazi Persecution of Soviet Prisoners of War   encyclopedia ushmm org  Retrieved              Mason  Amanda     June         ,"['Two', 'Nazi', 'The New Yorker  Retrieved', 'PMC', 'Holocaust', 'New York', 'Macmillan  p        ISBN                 Haaretz                Holocaust Facts  Where Does the Figure of   Million', 'Antonia                ', 'Million', 'Jewish', 'Nazis', 'Huffington Post  Retrieved               Non Jewish Victims', 'Holocaust', 'Retrieved               Nazi Persecution', 'Retrieved              Mason']",[]
140,What Life Was Like For POWs In Europe During The Second World War   Imperial War Museums  Retrieved              Schmitter  ,"['Europe', 'The Second World War   ', 'Imperial War Museums  Retrieved              Schmitter  ']",[]
141,Elke                Nazi Crimes  Diaries Reveal How Much Wartime Germans Knew   Spiegel Online  Retrieved              Ezard  John                Germans knew of Holocaust horror about death camps   The Guardian  ISSN            Retrieved                ,"['Spiegel Online  ', 'John                Germans', 'Holocaust', 'Guardian', 'ISSN']",[]
142,Oh  ,[],[]
143,No  It Can t Be    Holocaust Teacher Resource Center   Retrieved              Mulhall  ,[],[]
144,Joe                Holocaust denial is changing   the fight against it must change too   Joe Mulhall   The Guardian  ISSN            Retrieved             Many people  including politicians and historians  consider the Holocaust to be worst event in history  and have described Hitler  his followers  and his regime as evil    ,"['Joe                Holocaust', 'Joe Mulhall', 'Guardian', 'Holocaust', 'Hitler']",[]
145,The man who dreamed of the atom bomb   BBC News              Retrieved               The Manhattan Project   Atomic Heritage Foundation     May       Retrieved               German Atomic Bomb Project   Atomic Heritage Foundation     October       Retrieved              Stockbauer  Marc     August         ,"['BBC News', 'Atomic Heritage Foundation']",[]
146,The Designs of  Fat Man  and  Little Boy    Stanford  Ethics of Development in a Global Environment  Archived from the original on             Retrieved               Little Boy and Fat Man   Atomic Heritage Foundation     July       Retrieved               Manhattan Project  Espionage and the Manhattan Project              United States Department of Energy Office of Scientific and Technical Information  Retrieved                  August        ,"['Fat Man', 'Stanford  Ethics of Development', 'Atomic Heritage Foundation', 'United States Department of Energy Office of Scientific and Technical Information  Retrieved                  ', 'August']",[]
147,First Soviet nuclear test  CTBTO Preparatory Commission   The Comprehensive Nuclear Test Ban Treaty Organization  Retrieved               Types of Nuclear Weapons  CTBTO Preparatory Commission   The Comprehensive Nuclear Test Ban Treaty Organization  Retrieved              de Castella  Tom     February         ,"['Soviet', 'CTBTO Preparatory Commission', 'The Comprehensive Nuclear Test Ban Treaty Organization  Retrieved               Types of Nuclear Weapons  CTBTO Preparatory Commission', 'The Comprehensive Nuclear Test Ban Treaty Organization  Retrieved              de Castella', 'Tom     ']",[]
148,How did we forget about mutually assured destruction    BBC News  Retrieved               Nuclear forces reduced while modernizations continue  says SIPRI   Stockholm International Peace Research Institute     June       Retrieved              Friedman  Uri                ,"['BBC News', 'Stockholm International Peace Research Institute     June       Retrieved', 'Uri                ']",[]
149,Why One President Gave Up His Country s Nukes   The Atlantic  Retrieved              DePetris  Daniel R                 Israel s Nuclear Weapons    Things You Need to Know   The National Interest  Retrieved               Treaty on the Non Proliferation of Nuclear Weapons  NPT    International Atomic Energy Agency              Retrieved               Libya Nuclear Weapons Program   Libya Nuclear Disarmament   NTI   www nti org  Retrieved               Major milestones of Iran s nuclear programme   Iran   Al Jazeera   www aljazeera com  Retrieved              Andrews  Evan     October           Attacks on United States Soil During World War II   HISTORY  Retrieved              Harrison  Mark                The Soviet Union after       Economic Recovery and Political Repression   Past   Present                doi         pastj gtq       ,"['One', 'Gave Up', 'The Atlantic  Retrieved', 'Daniel R', 'The National Interest  Retrieved               Treaty', 'the Non Proliferation of Nuclear Weapons  ', 'Libya Nuclear Disarmament', 'Iran', 'Iran', 'Al Jazeera', 'Evan     ', 'United States', 'World War II', 'Mark                The Soviet Union']","['Iran', 'Iran']"
150,The division of Germany   The Cold War               CVCE Website   Virtual Centre for Knowledge on Europe  Retrieved               Milestones              Office of the Historian   history state gov  Retrieved              Dobbins  James  Poole  Michele,"['Germany', 'The Cold War               CVCE Website', 'Historian', 'James  Poole']",['Germany']
151,A   Long  Austin         After the War  Nation building from FDR to George W  Bush  Rand Corporation  p      ISBN                  The Nuremberg Trial and the Tokyo War Crimes Trials               history state gov  Retrieved               Why Did the League of Nations Fail    www historyonthenet com              Retrieved               History of the United Nations   www un org              Retrieved              Parker  Clifton B                 Gandhi s nonviolent approach offers lessons for peace movements  Stanford scholar says   Stanford University  Retrieved              McQuade  Joseph    November         ,"['Austin         After the War  Nation', 'FDR', 'George W  Bush', 'Rand Corporation', 'The Nuremberg Trial', 'the Tokyo War Crimes Trials               ', 'the League of Nations Fail', 'the United Nations', 'un', 'Gandhi', 'Stanford', 'Stanford University  Retrieved              McQuade']",[]
