,sentence,entities,country_entities
26,The Greeks would have a bitter revenge of sorts  the attack caused a delay of several crucial weeks of the invasion of the United StatesSR  potentially hampering it     Europe at the height of German control in     On June           Hitler attacked Stalin with the largest army the world had ever seen  Over three million men and their weapons were put into service against the Soviet Union      Stalin had been warned about the attack  both by other countries and by his own intelligence network  but he had refused to believe it  Therefore  the Soviet army was largely unprepared and suffered massive setbacks in the early part of the war  despite Stalin s orders to counterattack the Germans      Throughout       German forces  divided into   army groups  Army Group A  Army Group B  and Army Group C   occupied the territories of the present day Ukraine and Belarus  laid siege to Leningrad  present day Saint Petersburg   and advanced to within    miles of Moscow  ,"['several crucial weeks', 'United', 'Europe', 'German', 'June           Hitler', 'Stalin', 'the Soviet Union', 'Stalin', 'Soviet', 'Stalin', 'the Germans', 'German', 'Army Group A  Army Group', 'Army Group C', 'Ukraine', 'Belarus', 'Leningrad', 'Saint Petersburg', 'Moscow']","['Ukraine', 'Belarus']"
27,At this critical moment  the Soviet people stalled the German Wehrmacht to a halt at the gates of Moscow  Stalin had planned to evacuate the city  and had already moved important government functions  but decided to stay and rally the city  Recently arrived troops from the east under the command of Marshal Georgy Zhukov counterattacked the Germans and drove them from Moscow     Mussolini had launched an offensive in North Africa from Italian controlled Libya into British controlled Egypt  However  the British smashed the Italians and were on the verge of taking Libya  Hitler decided to help by sending in a few thousand troops  a Luftwaffe division  and the first rate general Erwin Rommel      Rommel managed to use his small force to repeatedly smash massively superior British forces and to recapture the port city of Tobruk and advance into Egypt  However  Hitler  embroiled in his invasion of the Soviet Union  refused to send Rommel any more troops  causing Rommel to retreat and preventing him from seizing the Middle East  where Axis friendly regimes had taken root in Iraq and Persia  present day Iran          After the winter  Hitler launched a fresh offensive in the spring of       with the aim of capturing the oil rich Caucacus and the city of Stalingrad  However  he repeatedly switched his troops to where they were not needed  The offensive bogged down  and the entire  th Army  considered the best of German troops  was trapped in Stalingrad  Hitler now refused to let  th Army break out  ,"['Soviet', 'German', 'Moscow', 'Stalin', 'Georgy Zhukov', 'Germans', 'Moscow', 'Mussolini', 'North Africa', 'Italian', 'Libya', 'British', 'Egypt', 'British', 'Italians', 'Libya', 'Hitler', 'a few thousand', 'Luftwaffe', 'first', 'Erwin Rommel', 'British', 'Tobruk', 'Egypt', 'Hitler', 'the Soviet Union', 'Rommel', 'Rommel', 'the Middle East', 'Iraq', 'Persia', 'Iran          After', 'winter', 'Hitler', 'the spring', 'Caucacus', 'Stalingrad', 'Army', 'German', 'Stalingrad  Hitler', 'Army']","['Libya', 'Egypt', 'Libya', 'Egypt', 'Iraq']"
28,He insisted that the German army would force its way in  Hermann G ring also assured Hitler that the Luftwaffe could supply the  th Army adequately  when it could in reality only supply a minute fraction of the needed ammunition and rations  Eventually  the starved  th Army surrendered  dealing a severe blow to the Germans  In the end  the defeat at Stalingrad was the turning point for the war in the east     Meanwhile  the Japanese had attacked the United States at Pearl Harbor in Hawaii on December          ,"['German', 'Hermann G', 'Hitler', 'Luftwaffe', 'Army', 'Army', 'Germans', 'Stalingrad', 'Japanese', 'the United States', 'Pearl Harbor', 'Hawaii', 'December']",[]
29,This disastrous attack forced the Americans into the war  Parts of the German brass advised against declaring war on the United States  arguing that since Japan was the aggressor  the Tripartite Pact didn t bind Germany to do so  However  Hitler hoped that Japan would be able to quickly defeat the United States and then turn its attention on helping the effort against Russia  Both Germany and Italy declared war on the United States a few days after the attack     Turning tides edit A British soldier gives a V gesture to German prisoners captured at El Alamein     October     Throughout the rest of      and       the Soviets began to gain ground against the Germans after some victories like the tank battle of Kursk      ,"['Americans', 'German', 'the United States', 'Japan', 'Tripartite Pact', 'Germany', 'Hitler', 'Japan', 'the United States', 'Russia', 'Germany', 'Italy', 'the United States', 'a few days', 'British', 'German', 'El Alamein', 'October', 'Soviets', 'Germans', 'Kursk      ']","['Japan', 'Germany', 'Japan', 'Russia', 'Germany', 'Italy']"
30,By this time  Rommel had been forced to abandon North Africa after a defeat by Montgomery at El Alamein in what was the first decisive victory of the Allies over the Germany army  leading Churchill to declare it  the end of the beginning       ,"['Rommel', 'North Africa', 'Montgomery at El Alamein', 'first', 'Germany', 'Churchill']",['Germany']
31,On several fronts  the Wehrmacht had encountered serious casualties that it could not replace  Hitler also insisted on a  hold at all costs  policy which forbade relinquishing any ground  ,"['Wehrmacht', 'Hitler']",[]
32,He followed a  fight to the last man  policy that was completely ineffective  ,[],[]
33,By the beginning of       Hitler had lost all initiative in the Soviet Union  and was struggling even to hold back the tide turning against him     From      to       the United States and Britain acted in only a limited manner in the European theater  much to the chagrin of Stalin  They drove out the Germans in Africa  invading Morocco and Algeria on November              ,"['the Soviet Union', 'the United States', 'Britain', 'European', 'Stalin', 'Germans', 'Africa', 'Morocco', 'Algeria', 'November              ']","['Morocco', 'Algeria']"
34,Then  on July           the Allies invaded Sicily  in preparation for an advance through Italy  the  soft underbelly  of the Axis  as Winston Churchill called it  On September    the invasion of Italy began      By the winter of       the southern half of Italy was in Allied hands  The Italians  most of whom did not really support the war  had already turned against Mussolini  ,"['Sicily', 'Italy', 'Winston Churchill', 'September', 'Italy', 'the winter', 'half', 'Italy', 'Allied', 'Italians', 'Mussolini']","['Italy', 'Italy', 'Italy']"
35,In July  he had been stripped of power and taken prisoner  though the Italians feigned continued support of the Axis  ,"['July', 'Italians']",[]
36,On September    the Italians formally surrendered      but most of Italy not in Allied hands was controlled by German troops and those loyal to Mussolini s  Mussolini had been freed by German paratroopers  new Italian Social Republic  which in reality consisted of the shrinking zone of German control  The Germans offered staunch resistance  but by June          Rome had fallen     The Battle of the Atlantic took place from      to      and was described as  longest  largest  and most complex naval battle in history       The Germans hoped to sever the vital supply lines between Britain and America  sinking many tons of shipping with U boats  German submarines  However  the development of the destroyer and aircraft with a longer patrol range were effective at countering the U boat threat and by December       the Germans had lost the battle     Operation Overlord edit On June          the Western Allies finally launched the long awaited assault on  Fortress Europe  so wanted by Stalin  ,"['September', 'Italians', 'Italy', 'Allied', 'German', 'Mussolini', 'Mussolini', 'German', 'Italian Social Republic', 'German', 'Germans', 'June', 'The Battle of the Atlantic', 'Germans', 'Britain', 'America', 'German', 'December', 'Germans', 'June', 'Fortress Europe', 'Stalin']",['Italy']
37,The offensive  codenamed Operation Overlord  began the early morning hours of June    ,"['Operation Overlord', 'the early morning hours']",[]
38,The day  known as D day  was marked by foul weather   Rommel  who was now in charge of defending France against possible Allied attack  thought the Allies would not attack during the stormy weather  and was on holiday in Germany      ,"['Rommel', 'France', 'Allied', 'Allies', 'Germany']","['France', 'Germany']"
39,Besides this  the Germans were expecting an attack  but at the natural harbor of Calais and not the beaches of Normandy  They did not know about the Allies  artificial harbours  and false leads planted by the Allies suggested Calais as the landing site     United States assault troops approaching Omaha Beach    June      ,"['Germans', 'Calais', 'Allies', 'Allies', 'Calais', 'United States', 'Omaha Beach']",[]
40,By this time  the war was looking ever darker for Germany  On July           a group of conspiring German officers attempted to assassinate Hitler  ,"['Germany', 'July           ', 'German', 'Hitler']",['Germany']
41,The bomb they used did injure him  but the second was not used  and a table shielded Hitler in a stroke of luck      The plotters still could have launched a coup  but only the head of occupied Paris acted  arresting SS and Gestapo forces in the city  ,"['second', 'Hitler', 'Paris', 'SS', 'Gestapo']",[]
42,The German propaganda minister  Joseph Goebbels  rallied the Nazis and hunted down the conspirators  arresting up to      people in the wake of the plot  according to some estimates     In France  the Allies took Normandy and finally Paris on August         ,"['German', 'Joseph Goebbels', 'Nazis', 'France', 'Normandy', 'Paris', 'August         ']",['France']
43,In the east  the Soviets had advanced almost to the former Polish Soviet border  At this time  Hitler introduced the V weapons  the V   flying bomb and  later  the V    the first rockets used in modern warfare  ,"['Soviets', 'Polish', 'Soviet', 'Hitler', 'first']",[]
44,The V   was often intercepted by air pilots  but the V   was extremely fast and carried a large payload  ,[],[]
45,However  this advance came too late in the war to have any real effect      The Germans were also on the verge of introducing a number of terrifying new weapons  including advanced jet aircraft  which were too fast for ordinary propeller aircraft  and submarine improvements which would allow the Germans to again fight effectively in the Atlantic  All this came too late to save Hitler  ,"['Germans', 'Germans', 'Atlantic', 'Hitler']",[]
46,Although a September invasion of The Netherlands failed  the Allies made steady advances  In the winter of       Hitler put everything into one last desperate gamble in the West  known as the Battle of the Bulge  which  despite an initial advance  was a failure  because the introduction of new Allied tanks and low troop numbers among the Germans prevented any real action being taken  Nevertheless  it was one of the bloodiest battles of the war and the second costliest battle in the history of the American Army     Final days edit In early February       the three Allied leaders  Franklin Roosevelt  Winston Churchill  and Joseph Stalin  met at newly liberated Yalta in the Crimea in the Soviet Union in the Yalta Conference      Here  they agreed upon a plan to divide post war Europe  Most of the east went to Stalin  who agreed to allow free elections in Eastern Europe  which he never did  The west went to Britain  France  and the United States Post war Germany would be split between the four  as would Berlin  This division of spheres of influence would set up international diplomacy for the Cold War that would dominate the second half of the century     At the beginning of       Hitler was on his last strings  ,"['September', 'The Netherlands', 'Allies', 'the winter', 'West', 'Allied', 'Germans', 'second', 'the American Army     Final', 'days', 'early February', 'three', 'Allied', 'Franklin Roosevelt', 'Winston Churchill', 'Joseph Stalin', 'Yalta', 'Crimea', 'the Soviet Union', 'the Yalta Conference      ', 'Europe', 'Stalin', 'Eastern Europe', 'Britain', 'France', 'the United States Post war Germany', 'four', 'Berlin', 'the Cold War', 'the second half of the century']",['France']
47,The Soviets launched a devastating attack from Poland into Germany and Eastern Europe  intending to take Berlin  The Germans collapsed in the West  allowing the Allies to fan out across Germany  However  the Supreme Allied Commander  American general Dwight D  Eisenhower  refused to strike for Berlin  and instead became obsessed with reports of possible guerrilla activity in southern Germany  which in reality existed mainly in the propaganda of Joseph Goebbels      By April     the Soviets had besieged Berlin  Hitler remained in the city in a bunker under the Chancellery garden  On April     he committed suicide by shooting himself  after a ritual wedding with his longtime mistress Eva Braun      The Germans held out another   days under Admiral Doenitz  their new leader  but the Germans surrendered unconditionally on May          ending the war in Europe  see V E Day      Rivalries that had begun during the war  combined with the sense of strength in the victorious powers  laid the foundations of the Iron Curtain and of the Cold War The war in the Pacific edit Main article  Asiatic Pacific TheaterBackground edit The first event that is usually linked to the later Pacific conflict was the Mukden Incident of    September       during which the Japanese military staged the bombing of the South Manchuria Railway and pinned the blame on Chinese dissidents      Japan then used this as pretext to invade northeastern China the next day and turn the region of Manchuria into the Japanese puppet state of Manchukuo      After the League of Nations commissioned the      Lytton Report  which exposed the Mukden Incident as a Japanese ruse  Japan was left internationally isolated  withdrawing from the League of Nations in March       ,"['Soviets', 'Poland', 'Germany', 'Eastern Europe', 'Berlin', 'Germans', 'West', 'Allies', 'Germany', 'American', 'Dwight D  ', 'Eisenhower', 'Berlin', 'Germany', 'Joseph Goebbels      ', 'April', 'Soviets', 'Berlin  Hitler', 'April', 'Eva Braun      ', 'Germans', 'another   days', 'Doenitz', 'Germans', 'May', 'Europe', 'the Cold War', 'Pacific', 'Asiatic Pacific TheaterBackground', 'first', 'Pacific', 'the Mukden Incident of    September       ', 'Japanese', 'Chinese', 'Japan', 'China', 'the next day', 'Manchuria', 'Japanese', 'Manchukuo      After', 'the League of Nations', 'the      Lytton Report', 'the Mukden Incident', 'Japanese', 'Japan', 'the League of Nations']","['Poland', 'Germany', 'Germany', 'Germany', 'Japan', 'China', 'Japan']"
48,In      Manchukuo became a constitutional monarchy and the former Chinese Emperor Pu Yi was placed on the throne  despite the real power being held by Japan     ,"['Chinese', 'Pu Yi', 'Japan']",['Japan']
49,Despite relations between Japan and China suffering because the occupation of Manchuria  the situation did not turn into all out war until   July       when a dispute between Chinese and Japanese soldiers turned into a battle during the Marco Polo Bridge Incident      This  in turn  led to a further escalation of the hostilities  leading to the Second Sino Japanese War  one of the deadliest conflicts in human history      Japan enjoyed some early major victories  capturing both Shanghai and the Chinese capital of Nanjing in      and forcing the Chinese central government  s relocation to Chongqing  Following Chinese victories in Changsha and Guangxi in       the war reached somewhat of a stalemate  with Japan controlling the large cities  but being unable to rule the vast countryside      On    September       ,"['Japan', 'China', 'Manchuria', 'Chinese', 'Japanese', 'the Marco Polo Bridge Incident      This  in turn', 'the Second Sino Japanese War  one', 'Japan', 'Shanghai', 'Chinese', 'Nanjing', 'Chinese', 'Chongqing', 'Chinese', 'Changsha', 'Guangxi', 'Japan']","['Japan', 'China', 'Japan', 'Japan']"
50,Japan became cosignatories of the Tripartite Pact  joining a military alliance with Germany and Italy     Japanese Expansion edit United StatesS West Virginia during the attack on,"['Japan', 'the Tripartite Pact', 'Germany', 'Italy', 'Japanese', 'United', 'West Virginia']","['Japan', 'Germany', 'Italy']"
51,Pearl HarborOn December          Japan launched a surprise attack on the American base at Pearl Harbor as a mean of preventing the United States Pacific Fleet from interfering with its planned expansion in the area      The next day  following Roosevelt s Infamy Speech  the United States declared war on Japan  marking the official entry of both nations in World War             At the same time  Japan also launched attacks on Thailand  the British colonies of Malaya  Singapore  Hong Kong and American military bases in Guam  Wake Island and the Philippines      The next six months were dominated by Japanese victories against the Allied forces  already war weary and stretched thin after two years of war in Europe and North Africa  Japan managed to capture British Burma  New Guinea  the Dutch East Indies  the Solomon Islands  Bali and Timor       In March       days before the surrender of the Philippines  general Douglas MacArthur  who came out of retirement to become commander of United States Army Forces in the Far East at the onset of the war  was forced to flee and narrowly escape to Australia       On    February       Japan also launched a devastating aerial attack on the Australian city of Darwin  in what was the first attack by a foreign power on Australian soil      The turning of the tide came in early May  during the Battle of the Coral Sea  which proved the first strategic victory of the Allies against Japanese expansion       ,"['Pearl HarborOn', 'December', 'Japan', 'American', 'Pearl Harbor', 'the United States Pacific Fleet', 'The next day', 'Roosevelt', 'the United States', 'Japan', 'World War             ', 'Japan', 'Thailand', 'British', 'Malaya', 'Singapore', 'Hong Kong', 'American', 'Guam  Wake Island', 'The next six months', 'Japanese', 'Allied', 'two years', 'Europe', 'North Africa', 'Japan', 'British', 'Burma', 'New Guinea', 'the Dutch East Indies', 'the Solomon Islands', 'Bali', 'March       ', 'days', 'Philippines', 'Douglas MacArthur', 'United States Army Forces', 'the Far East', 'Australia', 'Japan', 'Australian', 'Darwin', 'first', 'Australian', 'early May', 'the Battle of the Coral Sea', 'first', 'Allies', 'Japanese']","['Japan', 'Japan', 'Japan', 'Thailand', 'Singapore', 'Japan', 'Burma', 'Philippines', 'Australia', 'Japan']"
52,This was followed one month later by the Battle of Midway  in which the United States Navy defeated an attacking Japanese fleet  inflicting devastating damage on the attacking force  The Battle of Midway is widely considered the most important naval battle of the Pacific Campaign and has even been described as  the most stunning and decisive blow in the history of naval warfare       ,"['one month later', 'the Battle of Midway', 'the United States Navy', 'Japanese', 'The Battle of Midway', 'the Pacific Campaign']",[]
53,The reasons usually given for the resounding victory are Japanese overconfidence in their own forces  poor planning and the intercepting of Japanese battle plans by the United States       The losses suffered during this Battle of Midway  paired with the campaign of attrition that was taking place in Solomon Islands  left Japan unable to replenish its forces and turned the tides of war against it  By August       ,"['Japanese', 'Japanese', 'the United States       The', 'this Battle of Midway', 'Solomon Islands', 'Japan', 'August']",['Japan']
54,the Allied forces were on the offensive  earning victories in the New Guinea campaign at Guadalcanal  Milne Bay and Buna Gona      Allied offensive edit A map of the Japanese advance from      to     Over the next two years the Allies slowly captured one island base after another  trying to get closer to Japan itself  where it planned to launch massive strategic air attacks and  only if absolutely necessary  execute a ground invasion  ,"['Allied', 'New Guinea', 'Guadalcanal', 'Buna Gona      ', 'Japanese', 'the next two years', 'Allies', 'one', 'Japan']",['Japan']
55,By July       the United States recaptured Guam and captured Tinian  which finally put them in attacking range of mainland Japan using the new Boeing B    bombers       Despite the advances of the Allies  massive fighting was still taking place  both in South East Asia with the Japanese offensive in India and in the Pacific  with the Battle of the Philippine Sea  where Japan suffered major losses and definitively lost the ability to rely on aircraft carriers       ,"['July', 'the United States', 'Guam', 'Tinian', 'Japan', 'Boeing', 'Allies', 'South East Asia', 'Japanese', 'India', 'Pacific', 'the Philippine Sea', 'Japan']","['Japan', 'India', 'Japan']"
56,In later October  a combined attack of American and Australian forces took on the Imperial Japanese Navy during the Battle of Leyte Gulf in what was to be the largest naval battle of World War II and possibly the largest naval battle of all time       ,"['later October', 'American', 'Australian', 'the Imperial Japanese Navy', 'the Battle of Leyte Gulf', 'World War II']",[]
57,The Allied victory achieved its stated goal of further severing oil supplied to the Japanese army  which was already struggling to fuel the remainder of its naval power       The battle of Leyte Gulf is also notable as the first battle in which Japanese aircraft carried out organized kamikaze attacks      By early       the Americans set their eyes on the Japanese island of Iwo Jima  which was of great strategic importance  being situated halfway between Tokyo and the Mariana Islands  Capturing the island meant not only a better launch station for aerial attacks against mainland Japan  but also the prevention of its use as an early warning station against air raids  ,"['Allied', 'Japanese', 'Leyte Gulf', 'first', 'Japanese', 'Americans', 'Japanese', 'Iwo Jima', 'Tokyo', 'the Mariana Islands', 'Capturing', 'Japan']",['Japan']
